{
  "$schema": "./schemas/colors-schema.json",
  "version": "1.0.0",
  "description": "Design system color tokens - source of truth for iOS and Android",
  "colors": {
    "primary": {
      "main": "#007AFF",
      "light": "#5AC8FA",
      "dark": "#0051A8",
      "contrast": "#FFFFFF"
    },
    "secondary": {
      "main": "#5856D6",
      "light": "#AF52DE",
      "dark": "#3634A3",
      "contrast": "#FFFFFF"
    },
    "accent": {
      "main": "#FF9500",
      "light": "#FFCC00",
      "dark": "#FF3B30",
      "contrast": "#000000"
    },
    "semantic": {
      "success": "#34C759",
      "warning": "#FF9500",
      "error": "#FF3B30",
      "info": "#007AFF"
    },
    "neutral": {
      "white": "#FFFFFF",
      "gray50": "#F9FAFB",
      "gray100": "#F3F4F6",
      "gray200": "#E5E7EB",
      "gray300": "#D1D5DB",
      "gray400": "#9CA3AF",
      "gray500": "#6B7280",
      "gray600": "#4B5563",
      "gray700": "#374151",
      "gray800": "#1F2937",
      "gray900": "#111827",
      "black": "#000000"
    },
    "background": {
      "primary": "#FFFFFF",
      "secondary": "#F9FAFB",
      "tertiary": "#F3F4F6",
      "elevated": "#FFFFFF"
    },
    "text": {
      "primary": "#111827",
      "secondary": "#4B5563",
      "tertiary": "#9CA3AF",
      "disabled": "#D1D5DB",
      "inverse": "#FFFFFF"
    },
    "border": {
      "default": "#E5E7EB",
      "focus": "#007AFF",
      "error": "#FF3B30"
    }
  },
  "darkMode": {
    "background": {
      "primary": "#000000",
      "secondary": "#1C1C1E",
      "tertiary": "#2C2C2E",
      "elevated": "#1C1C1E"
    },
    "text": {
      "primary": "#FFFFFF",
      "secondary": "#EBEBF5",
      "tertiary": "#8E8E93",
      "disabled": "#3A3A3C",
      "inverse": "#000000"
    },
    "border": {
      "default": "#38383A",
      "focus": "#0A84FF",
      "error": "#FF453A"
    }
  },
  "platforms": {
    "ios": {
      "systemBlue": "#007AFF",
      "systemGreen": "#34C759",
      "systemIndigo": "#5856D6",
      "systemOrange": "#FF9500",
      "systemPink": "#FF2D55",
      "systemPurple": "#AF52DE",
      "systemRed": "#FF3B30",
      "systemTeal": "#5AC8FA",
      "systemYellow": "#FFCC00"
    },
    "android": {
      "primaryContainer": "#D3E4FF",
      "onPrimaryContainer": "#001C38",
      "secondaryContainer": "#E2DFFF",
      "onSecondaryContainer": "#1A1249",
      "tertiaryContainer": "#FFD8E4",
      "onTertiaryContainer": "#3E001D"
    }
  }
}
